content,user_name,comment_id,user_id,tv_id
一样的五星推荐，感人至极，真实的感情，真实的感动，感觉心是柔软的，好的电影不需要多余的特效，多么劲爆的情节，只需要平淡的表达作者想表达的东西就好，真的很喜欢这部电影，大赞。,朴讷诚笃的拉马尔布斯,40016625348,1345645674,689483800
！用心去看这部影片，会明白很多道理，我们人类处心积虑的勾心斗角！我们人类为了利益甚至出卖自己的灵魂！我们太累了。处处算计。处处小心！不累吗？而龙奋不顾身的寻找小男孩，而龙不好安危的保护小男孩，只为了最真情的一个守护，只为了最平淡的一个生活！对龙而言，也许一个拥抱就够了！,189****2211_m2601,40039916748,1292551601,689483800
真的是一部非常感人的电影 从来没看哭过 第一次 可爱的龙 太感人了 值得用心去看的,小鱼摇摆,40146135048,1269162509,689483800
"这部剧没有华丽的特效，只是用了最真实的感情来拨动你心中最后一块柔软的深处。平平淡淡没有大起大落。却看得让人泪点满满。
",_毛三爷,40006876748,1349969056,689483800
真的是一部很感人的电影  好喜欢龙  好可爱啊啊啊  希望有第二部,爱吃汉堡的万俟淑雅,40042905548,1416459074,689483800
真的很感动，特别是后面那深情的拥抱，感动的简直要哭了,hcz0327,40017897548,1255666200,689483800
为什么看的人这么少，这么感人，这个龙太可爱了。希望大家好好爱护动物,是我我喜欢你,39950030248,2328898680,689483800
好感人哦，我都看哭啦，陪着皮得一起长大，谁在一起，吃在一起，一起玩耍，好感动，龙好可爱,大宝子（辰）,40148314648,1321230570,689483800
非常好的剧，值得推荐。值得收藏。,呱呱打翻叉,40147991048,423044563,689483800
特别可爱特别萌的大龙,isolde_007,40147420448,1266096083,689483800
真的特别好看，特别感人。结局也挺好的。。,181****6641_m1654,40035421848,1269686000,689483800
这部电影充分地写出了  人与动物之间的 亲密关系  不光是龙   世界上的所有动物    只要认真相处   拿出你的认真和关爱  他就会保护你    大赞,七秒记忆的驴,39974946748,2442669117,689483800
我们从小就有过这样的梦想，这电影表达了我们小时候的梦想      最喜欢这样的科幻片,158****8142_m1956,40023998848,1270955805,689483800
就像金刚一样保护自己喜欢的人很感动[表情],132****0239_m1905,39975464248,1205435195,689483800
太棒了，喜欢龙龙，不说话可是意思都懂，点券用的值了。喜欢，五星推荐,宝蛋的小棠棠,39934977248,1300870105,689483800
触动心灵的电影。值得观看。值得推荐   。,2379583577,39950311048,2379583577,689483800
非常好，我喜欢，你也喜欢,MMHH18享壹哲悠慧,40148649648,1412916670,689483800
漂亮的龙，好可爱的鼻子。,139****9398_m1714,40148873448,1151401774,689483800
大萌龙也找到家人了，完美感人的结局😀,艾灸宅一起,40148631448,1194587091,689483800
可能因为从小看这类的电影，所以特别喜欢小动物，在我看来，狗狗猫咪，都不是孩子，而是像精灵一样的存在。他是生命中的精灵,185****4885_m1863,40147968048,1194949025,689483800
多么美好的故事真的非常的感同身受，如果我是那个男孩该有多好，好感动,Seattle_wx1620,40133270948,2469627937,689483800
看了这么多龙，这条最可爱，比有的人还漂亮，值得看,……婧一一,40043291548,1413034195,689483800
真的很喜欢这部电影，好喜欢好喜欢,187****9016_m1290,40043437148,1233290378,689483800
特别特别感动,138****7844_m1748,40043240348,1111632301,689483800
无言的欣喜  无言的感动  美丽的故事,天时地利人和嗯,40043091648,1224916955,689483800
好看也很感动，希望能有第二部，期待,188****9409_m1101,40042901548,1214524906,689483800
保护大自然。才能保护大家的梦想,乐口福_wx1704,40042407748,2431592772,689483800
很感人的电影，彼得很勇敢，我们要珍爱我们的家人包括巨龙。,Mgong325,40042212648,4587070935,689483800
太感人了 很喜欢小男孩和龙在一起的时候 结局很好 龙和小男孩都过上了该属于他们的生活   很喜欢,利威尔的小可爱.,40039615548,1410199880,689483800
超喜欢这个电影，儿子也特别喜欢，大爱,188****2076_m1692,40040405448,1254948011,689483800
好温情，好感人,爱喝红茶de公羊舒兰,40143666948,1318307342,689483800
非常好，我喜欢，你也喜欢,MMHH18享壹哲悠慧,40143333148,1412916670,689483800
龙的眼神好温柔，好可爱,恋花一世1,40142139148,1397470162,689483800
我承认我看哭了，好感人,lv女士,40141822848,1320763005,689483800
好感人的一部电影，很喜欢，五颗心,心灵_wx2306,40138451748,2440405004,689483800
好感人 五星推荐 哭了半天😫,爱青青永远帅,40137560848,1392171504,689483800
可爱的龙，给了皮特6年的陪伴。很感人,爱懒床de公孙元亮,40136944948,1315952890,689483800
好感动，推荐看,爱吃烧烤の公西念桃,40135413048,1407653518,689483800
好感人，保护大自然,紫色泪770663986,40134740048,1227367937,689483800
好看，感人，结局比较完美,138****1456_m2691,40134655248,1210663354,689483800
好喜欢这么可爱的龙,枯叶蝶_wx1082,40133127348,2431768736,689483800
感动的哭了，值得用劵观看的电影！！,优质绿茶茉莉清茶,40130070448,1247037998,689483800
五星好评，很暖心的作品，满满都是正能量，满满都是温馨，期待更多这样的作品,宠新的主公儿,40129370548,2153830550,689483800
可爱的龙，希望与人类共生共存！,媚小（应子）,40128184548,2517894816,689483800
看的我哭了好几次，温馨又感动,152****7550_m1523,40119675148,1286504530,689483800
很喜欢，最质朴的感情最珍贵,133****1180_m1762,40118295448,1285420089,689483800
好感人，特喜欢........,135****8427_m1303,40111388148,1102037422,689483800
值得一看满感人的这用卷不亏。,爱晨练的东门涵韵,40107210348,1312438733,689483800
最纯洁的友谊,136****1980_m2535,40061478748,1254399741,689483800
挺感人的一部电影，人与依然和谐相处吧,《紫色熏衣草》,40055595948,2498413458,689483800
确实染色的二哈，有点丑化了中国人对龙的向往,郑页明,40041765248,2492581138,689483800
hen很让人感动的一个电影 ·不管动物的大小·他都没有伤人·很赞的·一部电影··小男孩不见了·龙自始至终都在奋不顾身的寻找小男孩，而龙不好安危的保护小男孩，只为了最真情的的保护他·！对龙来说只要一直拥抱就够了！陪着小男孩·,152****8926_m2723,40041331048,1243879371,689483800
特别好看，好可爱好有爱的龙,相见恨晚来日方长,40041337048,1410309302,689483800
结局用了，只有小孩才能找到龙。其实他表达了小时候才能得天真善良,妖邪无恒,40040072448,1304485381,689483800
好喜欢那只可爱的龙💗,139****8255_m1501,40039668548,1150515302,689483800
太好看了，都感动哭了，希望他们永远这样,毁了沁→_→,40039261048,2383365794,689483800
好感人。值得一看,186****3687_m2795,40039194648,1230518209,689483800
也许真有龙的存在 只是它会隐身 前提是在环境允许的条件下  不管存不存在 都值得人类思考,爱吃蛋糕的公孙嘉木,40039143048,1379310776,689483800
喜欢[表情]又感人,爱骑行de王官秀媚,40036805648,1307093111,689483800
很喜欢龙，感觉挺感人的，,失去否ii,40036699048,1306846525,689483800
好感动值得观看,cyq秋天,40035141848,1418585506,689483800
很好的电影，很感人，真心得喜欢，,可爱的小肥肉嘿嘿,40034870148,2463721482,689483800
很感人哦  推荐看的 触动内心深处的情感,犯二青年啦啦,40033927548,1298694325,689483800
可爱的大龙 感动,梦梵PINK,40033472448,1274422681,689483800
非常感人的一部电影，看了之后非常感动，看了这部电影想起了和妈妈一起看尼斯湖水怪的场景，想起了妈妈爱自己的点点滴滴，感人至深，朋友看完这个电影可以去看一下尼斯湖水怪，这两个电影都是感人至深的电影。,bhggkkgvgy,40033409048,1416033422,689483800
这是个非常有趣的故事感动到我了，一定要爱护,.枫城.,40019586748,2381473744,689483800
挺有感触，触动心灵感应影视，艺术气息特别浓厚，很好,邓美君_qq1596,40007644748,2502306316,689483800
深入人心，你们看懂了吗？作者告诉我们现在很多人贩卖保护动物，有些傻逼土豪私自养这些保护动物，把他们关在冷冰冰的笼子里，没有自由，如果你是人被关在监狱没有自由什么感受了？所以请那些缺德人，住手吧，请爱护保护小动物，它们需要是自由，请不要再伤害他们，满足你的狗屁虚荣心,_wx5132,40007086648,2483883216,689483800
这种题材的电影应该多出 电影体现了人与动物之间的信任与亲密，一部触动心灵 正能量的电影。给5星好评！！！,鱼鱼小作坊,39987656348,1323503214,689483800
不喜欢这个结局.很希望和龙在一起,暴走萝莉Jix大美,39956876748,1257424210,689483800
可以的，让我们一起保护动物，不乱砍树木，龙龙可爱！！,2990793241,39976348748,1213477466,689483800
喜欢龙龙，好可爱。值了,151****7647_m1948,39973789948,1241634596,689483800
很喜欢那条胖胖的龙  好可爱,186****1156_m1521,39975882748,1262942116,689483800
深入人心。值得一看。喜欢埃利奥。,付家小幺,39974703948,56475399,689483800
太感人了！！太可爱了。,眉目如画の艾瑞琪扎戈斯基,39972487748,2447344663,689483800
好看，挺感人的，喜欢胖龙,抱着嫦娥烤玉兔_wx1326,39969391448,2433018907,689483800
用券看的人还是很多的，温暖,一心一毅俩宝贝,39964442448,1257388263,689483800
很感动，很感动。,爱吃栗子de赫连又儿,39948734348,2498659558,689483800
特别喜欢那个胖胖的龙,渲染流年_qq1755,39950420048,2414062719,689483800
最喜欢这里淡淡的温馨,爱喝汽水の万俟友容,39936196148,1390638667,689483800
好看 五星好评 动物与人的接触好温馨 值得一看！！！,时光流逝²★,39933489948,2380550276,689483800
对于喜欢这类事物的人来说好看   不喜欢的就别看了,爱骑马の长孙紫夏,39930105648,1300898289,689483800
温馨而感人的真情流露，最容易触及人们内心的柔弱。,阳光下的人儿☀,40148677048,1417571196,689483800
必须给五星。结局也很是满意。,小雯子19930826,40148340948,1205368055,689483800
我的儿子们都喜欢吧？,  心相印,40148179948,2282246625,689483800
反正我喜欢，喷子走远些,138****8431_m1384,40148021848,1215819597,689483800
小龙好可爱，电影好感人,157****2695_m1529,39973374748,1274011009,689483800
很久没看到这样好看的电影了，太感人了！,huangbin_qq1236,40146467048,2427080534,689483800
很好看的一部剧 我很喜欢 看得我哭了好几次 支持,爱喝酸奶de公良寄松,40145955748,2432009415,689483800
蠢萌的龙，可爱的男孩。只戳笑点和泪点。人总是从人至上励合角度去对待每一个事物，真的很让人讨厌！,公良白卉,40145707048,1382052787,689483800
真心不错，感动,蒋伟_qq1756,40145577948,2141996485,689483800
好感动~_~~_~~_~~_~~_~~_~,米娜桑mns,40145270848,1413854078,689483800
绝对良心片！！,爱骑马de百里问芙,40144396748,1304318361,689483800
感动的哭了,昵称已经被占用（｡ò ∀ ó｡）,40143230348,1409610855,689483800
保护地球环境，,念一种_暖心wx1991,40143118148,2234457023,689483800
喜欢,一一而行,40141052648,2340617009,689483800
热泪盈眶。美好故事,cindygeng,40140736448,1015086632,689483800
感动到哭,爱吃烤馒头的尉迟听春,40139926148,1353793065,689483800
超级感人，哭了几回了,186****6139_m2115,40139494448,1248609949,689483800
这部电影看的让人感动,爱喝牛奶de谷梁平露_1610,40139071948,1386122531,689483800
太棒了！值得看看，结局很好，很美,xiaorui依依,40139057648,1402794606,689483800
很精彩[表情]个人表示很喜欢,支～XL,40135698448,2314894249,689483800
好感动,136****6699_m1350,40138989048,1207955188,689483800
不说感不感人。三个字《龙之古》,【杜嘉欣】,40137195848,1274201607,689483800
感动！,爱玩标枪de宗政念云,40137025048,1357372834,689483800
把我感动哭了,131****9238,40148025048,1072013066,689483800
值得一看，不错！,爱打乒乓球的羊角运鹏,40147965148,1354023183,689483800
最后彼得去了属于自己的地方  埃利奥特也找到了自己的家人  感动,不特别但,40118568948,2258805727,689483800
保持原有的别去随意破坏即可，相互尊重才会和谐。,134****4919_m1439,40118300048,1265222357,689483800
感人,刘qin_qq1351,40116677148,2261774797,689483800
感动,xminaiqing,40116574648,1324416049,689483800
也很感人,爱喝绿茶的子书樱花,40116404248,1360592041,689483800
很是感动，,苦笑`却始终释怀,40111830948,2438507680,689483800
这条龙还会隐身术真可爱[表情],爱马拉松の微生采蓝,40111468848,1364400989,689483800
结局很棒，小男孩有了家人，龙找到了自己的族人！就爱看迪士尼的，结局完美,爱打台球の微生清华_1571,40110404848,1386486336,689483800
很有爱，喜欢！,左手欢笑友手忧伤,40109673748,1387245717,689483800
什么都完美……就是这个龙为什么是狼叫,宝猪驴,40108679648,2353967066,689483800
我喜欢看你,贝思蜗牛,40141205248,1383410653,689483800
好好看     太感人了,雅馨浪迹,40141185348,2376990990,689483800
真心好看。   没有买卖就没有杀害。    保护地球资源！,独家记忆 好吧？,40105845148,2066363768,689483800
感动,151****7325_m1432,40105835648,1239336798,689483800
幸好结局是完美的，不然我会失望的不得了的。值得一看的好电影！,请叫我灰太狼大王,40105748548,2141090592,689483800
好感动,July☀️天晴,40105747748,2289550569,689483800
龙和小孩拥抱的时候太感人了我哭了,康康的时间,40104054248,1267798842,689483800
故事简单 但细节非常到位 结局非常完美,醒着的猪,40103476248,1328762128,689483800
太感人了,忘不掉的只會是你,40103307048,1379779892,689483800
这是一条可爱的龙,136****0992_m1475,40102596248,1225920866,689483800
喜欢,小鱼同志很乐观,40102536748,1420275920,689483800
好可爱的二哈，尤其是抱抱的动作,133****5711_m1405,40101576548,1295517002,689483800
龙真招人稀罕,图.,40136938248,2338635502,689483800
好看，感动。,韩小菲00,40136836348,1381506853,689483800
感动的哭了,150****0792_m1396,40135801448,1075022664,689483800
好感人,绝顶聪明de史蒂夫柏德,40135255448,1369952265,689483800
看了好多次了 感动,诺_qq7959,40134219548,2290738240,689483800
这片子被剪得没道理啦,139****1891_m1104,40134172348,1179813306,689483800
特别感动，不由得流泪,150****0080_m1544,40133932448,1164914584,689483800
感动[表情]女儿看得感动得眼泪直打转，虽然她听不懂，但是她看得懂,――小萝莉控,40133221348,2509326171,689483800
感人！,换不来真心↑,40128804548,2435060643,689483800
真好看，我喜欢这个结尾,135****2161_m1677,40118786348,1157941557,689483800
好看 还不错 感人 ,137****6768_m2242,40101504848,1297038267,689483800
良心之作啊,我是小坑蛋,40101041948,1392488272,689483800
好感动 看的我都哭了,18911751741,40082591748,1227827984,689483800
很很感人的故事,222_qq3871,40064722948,2205171823,689483800
好可爱的龙,爱玩乒乓球de公孟秀越,40063289448,1374162120,689483800
看过所有电影最完美的一个结局，没有之一！,段同学呐儿,40062745948,1344028362,689483800
好好看，感人,130****4676_m1769,40061084548,1213717860,689483800
好感人！,流浪8886,40059997448,1236411709,689483800
好感人的故事！超级赞\(≧▽≦)/,137****5584_m1189,40058382148,1145609798,689483800
值得看，哭了,外向の提拉埃尔比埃,40056955048,1350316631,689483800
我都哭了，太感人了,八二年的小洋人ing,40056629348,1386784636,689483800
感人,爱弹钢琴の澹台雅素,40056121148,1393819372,689483800
好感动  赞,半路缘分♥,40055734448,2254887775,689483800
五星五星推荐,爱宇0330,40055552848,2086123471,689483800
可爱的龙龙,183****4712_m1552,40053298048,1263140966,689483800
美國電影就是不一樣！特別感人,安小轩丶_qq1994,40053259348,2307694694,689483800
很好的电影 漂亮,戈庆_qq1906,40052365748,2149823086,689483800
超级好看，真的超级感人，有没有和我一样哭的稀里哗啦的……,云_wxls0k1,40051009648,2418907223,689483800
喜欢这类型的,徐小兮妹妹,40049357348,1298181182,689483800
有没有这么夸奖，我看了怎么没哭,艾莎女王冰雪奇缘,40049332048,1280449558,689483800
外国人拍的电影，也么就很喜欢呢,152****0295_m1972,40049231048,1239101243,689483800
感人,不要乱用我的点播劵,40048558848,2182586408,689483800
真好 最后龙找到了家人 小男孩也有了家人 温暖,151****4110_m1439,40048532448,1196355276,689483800
好好看吖，太感动了,158****1620_m1625,40047924248,1178638151,689483800
在我心中最喜欢的两条龙，埃利奥特，无牙仔,涛_qqqizx1,40047842848,2494510354,689483800
喜欢、感觉跟真的一样、我都融化进去啦、我好像就是那个男孩、点赞吧,不三不四我是二  จุ๊บ ,40046402248,1197213659,689483800
好值得看！！！！,9D8B2BF2-441D-4B03-9575-FE4912A0BC64,40046471548,4987606209,689483800
一般般，感人到哭不至于。,黄坤_qq1770,40046408848,2154161252,689483800
太感人了 真心觉得有些人类还不如动物重情义,ぴ.眼眸里印不出你的温柔_wx1683,40045670848,2357873620,689483800
太好看了，好感人！,丫头匵666,40045361048,1299638009,689483800
真心好看 感动,秋风吹过的冬季,40045175948,1293361179,689483800
陪伴 守护在你最爱的人身边是最幸福的事,NANA在线♛珍,40045094848,1311346552,689483800
真的是部不错的电影  看到最后实在忍不住哭了,爱吃水果的公仲祺祥,40045088948,1379221102,689483800
彼得带上我去看龙龙，|｡･㉨･)っ♡　喜欢你♪,小翟_qq1122,40044439648,2103605280,689483800
要是这龙被人弄了。这电影就是坏蛋。剧情完美。龙王传说。感动,小翟_qq1122,40044167748,2103605280,689483800
666，真情实感，超感人！厉害！,深圳成龙威跆拳道桢教练,40044107548,2349595708,689483800
特别棒。,慕羽橙baby,40044029648,1301110582,689483800
看完这个以后打野不打龙了。感动！！！,150****4373_m1276,40043715548,1243183941,689483800
好感人,放手成全也是彼此重生,40043421148,1319094814,689483800
龙好可爱,icantv,40042833948,2157016769,689483800
很好看，很感人,皓皓麻麻_,40042832948,2344146185,689483800
太感动了,爱吃泡面の子书建安,40041609048,1360327362,689483800
剧情简单！不过还不错，那条西方龙蛮可爱的！,Jackie.Osen,40041278148,2337541056,689483800
以后再不打野的那个你过来我保证不打你！,155****5263_m1858,40041209848,1212747774,689483800
很感人，拍的挺好看的。,董小姐喜欢mini库柏,40041205848,2314456509,689483800
哭了好长时间，真的是很感人,啦啦啦卡卡卡卡卡,40040966748,2170972959,689483800
彼得真的好可爱,啦啦啦卡卡卡卡卡,40040939348,2170972959,689483800
看完电影了，哭的稀里哗啦的，太感人了，表达的情感，很丰富，必须5颗心,137****2423_m1190,40040654048,1160811684,689483800
真心的感动,忧@_@郁,40040376848,2259337473,689483800
很感动结局很好，贪懒的人不好,不怕鬼敲门，就怕鬼上身。_wx1434,40040110748,2387767673,689483800
感动ing[表情]。很好的结局，都有很好的归宿。不再有孤单，只有幸福。,捧花的我盛装出席却是错过你,40040140548,1324763982,689483800
❤️温暖人心,风一样自由的我,40039806848,1304909328,689483800
很好看  也很喜欢,18244744276,40039604248,1274732749,689483800
有寓意吗？美国佬与龙？不，“美国佬与’天马狗‘”。,mastermind80_bd1229,40039401348,2128011031,689483800
真的很感人，好好看,136****7524_m1136,40039076748,1207643797,689483800
稀里哗啦的哭，太感人！,小灰灰的小奶牛小七仔8600,40038902748,4698256285,689483800
好看好感人，泪点满满,思苏若玉,40038317748,1353727201,689483800
平平淡淡,188****8258_m2017,40038126748,1287564282,689483800
好看，感动！,杨子轩_qq2505,40038015848,2308300900,689483800
好感人我都哭了,易家利_m1092,40037932448,1275516419,689483800
感动到哭,爱吃烤馒头的尉迟听春,40139926148,1353793065,689483800
超级感人，哭了几回了,186****6139_m2115,40139494448,1248609949,689483800
太棒了！值得看看，结局很好，很美,xiaorui依依,40139057648,1402794606,689483800
这部电影看的让人感动,爱喝牛奶de谷梁平露_1610,40139071948,1386122531,689483800
很精彩[表情]个人表示很喜欢,支～XL,40135698448,2314894249,689483800
好感动,136****6699_m1350,40138989048,1207955188,689483800
不说感不感人。三个字《龙之古》,【杜嘉欣】,40137195848,1274201607,689483800
感动！,爱玩标枪de宗政念云,40137025048,1357372834,689483800
龙真招人稀罕,图.,40136938248,2338635502,689483800
好看，感动。,韩小菲00,40136836348,1381506853,689483800
感动的哭了,150****0792_m1396,40135801448,1075022664,689483800
好感人,绝顶聪明de史蒂夫柏德,40135255448,1369952265,689483800
看了好多次了 感动,诺_qq7959,40134219548,2290738240,689483800
这片子被剪得没道理啦,139****1891_m1104,40134172348,1179813306,689483800
特别感动，不由得流泪,150****0080_m1544,40133932448,1164914584,689483800
感动[表情]女儿看得感动得眼泪直打转，虽然她听不懂，但是她看得懂,――小萝莉控,40133221348,2509326171,689483800
感动,159****8949_m1717,40131115448,1259674596,689483800
我觉得这条龙好有爱的，很善良！希望它不要再受到伤害,尘颜_wx1884,40130579948,2473870194,689483800
一部好看而且感人的电影，绝对五颗心,@逝去的幸福,40130375148,2507648147,689483800
感人！,换不来真心↑,40128804548,2435060643,689483800
感人！,亮啦773,40122880348,2006372924,689483800
龙很可爱,爱喝纯净水の拓跋念霜,40122620348,2516553878,689483800
真心好看。感人。,135****3276_m2071,40122511348,1294708817,689483800
感人,137****7384_m1381,40121727448,1206431485,689483800
美好的大结局,风起时想你_qq1762,40121434348,2254374533,689483800
感动,匿名用户4994522899y,40120717848,4994522899,689483800
真好看，我喜欢这个结尾,135****2161_m1677,40118786348,1157941557,689483800
最后彼得去了属于自己的地方  埃利奥特也找到了自己的家人  感动,不特别但,40118568948,2258805727,689483800
保持原有的别去随意破坏即可，相互尊重才会和谐。,134****4919_m1439,40118300048,1265222357,689483800
感人,刘qin_qq1351,40116677148,2261774797,689483800
好感动,July☀️天晴,40105747748,2289550569,689483800
龙和小孩拥抱的时候太感人了我哭了,康康的时间,40104054248,1267798842,689483800
故事简单 但细节非常到位 结局非常完美,醒着的猪,40103476248,1328762128,689483800
太感人了,忘不掉的只會是你,40103307048,1379779892,689483800
这是一条可爱的龙,136****0992_m1475,40102596248,1225920866,689483800
喜欢,小鱼同志很乐观,40102536748,1420275920,689483800
好看 还不错 感人 ,137****6768_m2242,40101504848,1297038267,689483800
好可爱的二哈，尤其是抱抱的动作,133****5711_m1405,40101576548,1295517002,689483800
良心之作啊,我是小坑蛋,40101041948,1392488272,689483800
最后好感人,你必须接住我对你的好,40100597248,2334657202,689483800
感动,xminaiqing,40116574648,1324416049,689483800
也很感人,爱喝绿茶的子书樱花,40116404248,1360592041,689483800
很是感动，,苦笑`却始终释怀,40111830948,2438507680,689483800
这条龙还会隐身术真可爱[表情],爱马拉松の微生采蓝,40111468848,1364400989,689483800
结局很棒，小男孩有了家人，龙找到了自己的族人！就爱看迪士尼的，结局完美,爱打台球の微生清华_1571,40110404848,1386486336,689483800
很有爱，喜欢！,左手欢笑友手忧伤,40109673748,1387245717,689483800
什么都完美……就是这个龙为什么是狼叫,宝猪驴,40108679648,2353967066,689483800
感动,151****7325_m1432,40105835648,1239336798,689483800
真心好看。   没有买卖就没有杀害。    保护地球资源！,独家记忆 好吧？,40105845148,2066363768,689483800
幸好结局是完美的，不然我会失望的不得了的。值得一看的好电影！,请叫我灰太狼大王,40105748548,2141090592,689483800
这也一个值得我用券看？太辣鸡了,倾尽天下之の乱世繁华,40070376248,1298281921,689483800
结局很满意,人终会老ぃ,40068731448,2129295965,689483800
太感动了   忍不住的哭,左让右刘,40066305348,1286995254,689483800
好看，很感人,永远是晴天…,40066260948,1395622230,689483800
很很感人的故事,222_qq3871,40064722948,2205171823,689483800
好可爱的龙,爱玩乒乓球de公孟秀越,40063289448,1374162120,689483800
看过所有电影最完美的一个结局，没有之一！,段同学呐儿,40062745948,1344028362,689483800
好好看，感人,130****4676_m1769,40061084548,1213717860,689483800
好感人！,流浪8886,40059997448,1236411709,689483800
