content,user_name,comment_id,user_id,tv_id
好看，很喜欢，点赞，点赞，看这,MMHH18享壹哲悠慧,40145357748,1412916670,676191100
精彩不断，值得一看！！,爱柔道の东宫敏思,40054813748,2504823320,676191100
非常值得一看，强烈支持,落水狗狂撵落汤鸡,40051332648,2517942089,676191100
拍这部戏的时候我在现场,、小咖啡ㄟ_wx1379,40143837048,2450755397,676191100
这导演是我同学...,挥剑斩浮云！,40119091948,1152984499,676191100
挺好挺好,爱懒床的相里初瑶,40064632048,2517961525,676191100
棒棒哒,爱懒床的相里初瑶,40064418748,2517961525,676191100
不错不错,爱懒床的相里初瑶,40064408648,2517961525,676191100
支持一下,秦笑  艺海一粟,40063560948,2464416464,676191100
挺好,暗夜亡魂_qq1685,40062909448,2232174746,676191100
好看，很喜欢，点赞，点赞，看这,MMHH18享壹哲悠慧,40145357748,1412916670,676191100
精彩不断，值得一看！！,爱柔道の东宫敏思,40054813748,2504823320,676191100
非常值得一看，强烈支持,落水狗狂撵落汤鸡,40051332648,2517942089,676191100
拍这部戏的时候我在现场,、小咖啡ㄟ_wx1379,40143837048,2450755397,676191100
这导演是我同学...,挥剑斩浮云！,40119091948,1152984499,676191100
挺好挺好,爱懒床的相里初瑶,40064632048,2517961525,676191100
棒棒哒,爱懒床的相里初瑶,40064418748,2517961525,676191100
不错不错,爱懒床的相里初瑶,40064408648,2517961525,676191100
支持一下,秦笑  艺海一粟,40063560948,2464416464,676191100
挺好,暗夜亡魂_qq1685,40062909448,2232174746,676191100
拍的很用心！很好看,阿简1206,40057873548,1421705224,676191100
怎么才能给好评？,186****0321_m1120,40055744348,1110561539,676191100
前排支持！好片子！,孙睦欣,40039603548,2517925313,676191100
那个纸马是看隔壁村吹喇叭偷的，哈哈,爱吃香蕉de高堂思琪,40033407548,1417255028,676191100
挺好看的。,雪儿的爱情保卫战,39955005048,1379602428,676191100
不错,大鹏1972,39939469048,1421342628,676191100
支持原创！,六妞_wx1058,39933092348,2424292307,676191100
辣鸡剧情！糟蹋时间,　彭古励丶,39931665248,2331246428,676191100
那个一胖一瘦的演员，太给力了,爱吃香蕉de高堂思琪,39905347148,1417255028,676191100
真心不错，现阶段算是中国网络电影界的一股清流,飞鱼小崽,39900177348,2002611701,676191100
拍的可以 。很不错  角色之间的转换 情节很好,爱喝汽水de梁丘依珊,39896026548,1326817540,676191100
说这片垃圾的说明此人是一俗咖,爱玩篮球de轩辕建茗,40001369948,2517842875,676191100
怕了吗？多吓人！经典台词,xiaotao4463773,39994793448,1233220723,676191100
"这部戏简直就是垃圾,",177****3971_m1637,39944400048,1255812619,676191100
垃圾,爱喝汽水的主父欣愉,39926646848,1376506888,676191100
不好看,星屋顺112,39892835748,1155084555,676191100
难得见到好电影啊,飞鱼小崽,40127562548,2002611701,676191100
强烈推荐！非常值得一看！！,奇异看奇艺,40085070148,1421772589,676191100
不错不错值得一看,sjzsjzsjz,40081523548,1283842678,676191100
非常好,爱探险の相里香柏,40073603848,1421717287,676191100
支持支持！棒棒哒！,Dou-小嘟,40012886548,2106408009,676191100
我也看看看这个电影,于少堃＆瀚嘉文化产业发展集团,40006189348,2454236949,676191100
文艺片,爱玩篮球de轩辕建茗,40001313148,2517842875,676191100
棒棒哒🎊🎉🎉🎉🎊🎉🎉,爱玩篮球の赫连夜玉,39925344848,1335466625,676191100
这部剧感人的地方很多，我特别喜欢。,单位赖趋交,40037783548,2479781767,681848400
我特别喜欢这部剧，喜欢里面的每个角色。,用户6053896727,40116330248,2472103149,681848400
喜欢这样有意思的剧情故事，喜欢男女主角,拥有翅谋笔,40148436348,2472712276,681848400
还好淘到了这部剧，很多惊喜,用户6084342904,40147715248,2479847057,681848400
能看到这么出色的剧也是很开心呀。,丰富规女依,40145513348,2479480048,681848400
真的是被这样独特的剧情给吸引了。,娇嫩丽塘偷虚股脸,40104101548,2479740302,681848400
真的很赞这部剧，每一个角色都完美演绎，真的很喜欢。,欧阳春山挺直袁趁房钩,40038905148,2472389982,681848400
喜欢这样有意思的剧情故事，喜欢男女主角,岳千凡思春滑社袋齐,40038568148,2472092696,681848400
这样的剧情真的是很棒，相信很多观众都会喜欢。,固定寸针,40037292548,2474578751,681848400
绝对的良心之作呀，非常值得一看。,脏四子镜yiynt,40036171448,2474268998,681848400
这部戏是一部很轻松的剧，很好看的,黑白甜姓,40148992948,2474514456,681848400
真的太棒了，现在非常欣赏这个剧,韦胖厦宽敞烦,40148217148,2479492225,681848400
真心不错啊，演员都挺会表演的，我很喜欢看,用户6079151311,40147561348,2479488431,681848400
这部电影的确是吸引到我了,语素裕言沙葵员,40147495148,2479482328,681848400
我还是挺喜欢看这种电影的，很有感觉,削从深幅dwvot,40146746648,2474281868,681848400
演员的演技都很不错呀，我好喜欢看呀。,旧友少女乚,40146084948,2466486385,681848400
这就是我喜欢看的类型，必须追剧。,周梦权震怒焦医控贤,40146059748,2472404508,681848400
剧情超级吸引人，我已经无法抵挡了,强壮零强百辰窑快,40145701448,2479480658,681848400
编剧脑洞大开，我喜欢看这部剧。,上面唉丰凑,40145441648,2479491582,681848400
好棒的一部剧啊，我真的好喜欢看呢,残念i灬Tears冂,40143540148,2468279947,681848400
蛮喜欢这个电影的感觉。,东西庸千端离,40142593448,2479806321,681848400
编剧真是很用心呐，好喜欢这部剧呀，哈哈。,整齐缘燥,40112934448,2473242003,681848400
真的是好喜欢这样精彩的剧情。,用户6084349971,40112166048,2479655208,681848400
我刚刚简单看了一下剧情介绍，是我喜欢的风格。,恳露标mxawm,40109814848,2474609022,681848400
这部作品的风格很符合我的胃口,愉快蚊象气,40105808048,2479514439,681848400
最喜欢这个剧了，看不腻呀,众趋某码zfull,40105030248,2474375008,681848400
这部剧挺好看的，希望可以火起来,悲惨抚耽则,40039256148,2475006340,681848400
全程被这么棒的剧情吸引，看得很投入。,端木皱符巧嘴裕恒,40038564248,2474271619,681848400
我很多朋友都在看这剧，我也十分喜欢。,嫪恋熟叛辰质辩,40038306848,2479830871,681848400
演员的演技太棒了，真是完美的一部剧。,用户6053916833,40037805048,2474511631,681848400
哎，这人品怎么这么好呢，这部剧太好看了哇，我太喜欢了。,感恋妇逆笨附愉快惧靠,40036512348,2479677979,681848400
这是一部给我们观众惊喜的剧。,首尾旷浴,40036055948,2479479512,681848400
这部剧的风格还是很不错的，我很喜欢哦。,补摆爸交wews,40035815848,2474443441,681848400
真的被这么精彩的剧情吸引了，真好看。,美好亩挽闯,40035494748,2474710811,681848400
给好多朋友推荐了，都说很好看。,李如冰安静佘伶排既,40035415248,2472574731,681848400
这部戏是一部很轻松的剧，很好看的,山高筒蚀覆囊山需,40034617248,2480200294,681848400
导演是谁，我要好好感谢他！,殊解敌诱nvyol,40034087348,2474291859,681848400
这剧真是太好看了，我真是太喜欢了呀。,悲痛梁缠誓雀,40034086748,2474622142,681848400
编剧脑洞大开，我喜欢看这部剧。,兴奋塞握钟,40028915548,2479820153,681848400
喜欢西丽 身材好 演技在线,陈年往事66666,39948321148,2334284518,681848400
早就想看了，期待,miss♂进じ☆ve,39897791348,2269075022,681848400
吸血鬼类型良心之作！,熊猫互动,39895766548,1284367345,681848400
回复@赵只只YLY:漂亮极了！[好爱哦][好爱哦][舔屏][舔屏][舔屏][带着微博去旅行][兔子],王瑞儿_Real,39918695048,999999999,681848400
女吸血鬼身材漂亮,爱吃薯条の侍其开霁,39909818448,2513941892,681848400
支持一下！吸血鬼好漂亮,俊昕影业,39895690048,2079662132,681848400
主演真的好演技，好爱这精彩的表演,寂然瞎寄在画池,40148889648,2474331454,681848400
好好看耶，比那些老套剧情好看多了！超爱！,幽香任卵爸,40148884248,2479716016,681848400
好故事好剧本，演员们也演得很投入呀。,恐惧亡两,40148685648,2474289650,681848400
没有想到剧情竟然会这样发展。,漆桂号己ubcg,40148673648,2474381128,681848400
很棒的故事，很棒的精彩，不能错过啊。,善恶劝,40148647248,2479480783,681848400
挺新颖的题材，给人耳目一新的感觉,快乐逐言融奥,40144667248,2479701796,681848400
我觉得演员们演的都挺好的。,公孙直统伶仃丛苏,40144648748,2474630231,681848400
我要把这个剧转发出去呀，让更多人看到。,陌路呆子彡,40143360248,2472663970,681848400
剧情这样安排真的是厉害了。,取舍敞,40142334748,2474348353,681848400
能不能长一点呀，根本不够看的节奏呀,苗条版童面,40141282448,2479728060,681848400
好佩服编剧啊，这部剧真不错,尘世张蹈妻,40140621148,2474898111,681848400
我刚刚看了一下演员表，都是我所爱的！,思服侵形胀,40139953748,2479485424,681848400
这么好的片子，我当然是不会错过的。,卷惹作饭afodk,40139027648,2474309925,681848400
真是太高兴了，能够看到这么好的剧,左右虾睛兽,40138939448,2479847301,681848400
什么玩意啊，一点没看懂,高调说爱你爱你,40130314848,1167356372,681848400
很棒的故事，很棒的精彩，不能错过啊。,初恋骄现,40118587248,2479555657,681848400
想看的时候，挡都挡不住，太好看了,词组两济恰密杏,40117801348,2479536365,681848400
好好看耶，比那些老套剧情好看多了！超爱！,思春板歉,40117710348,2479715675,681848400
朋友分享给我的，一看就爱上了,畏缩未覆馆呈冈,40117162248,2479786541,681848400
这么精彩的故事情节真的是太棒了。,恬静架伍计钳国要,40116657148,2479652748,681848400
就这还是vlp,请叫:我小学姐％,40112333548,2492916171,681848400
如此精彩的剧，一定要支持哦。,存截任smibv,40112089748,2474351743,681848400
男主实力圈粉，这个剧很有意思，非常不错,粥湿藏ykxtk,40111339648,2474272778,681848400
就我觉得这部戏烂？,欧阳宣婼,40111263148,2181323109,681848400
真是一部有内涵的剧，没有故事的人是看不懂的。,颤抖散图盐,40110322648,2479763634,681848400
我成了死忠粉了，剧情真的很好精彩,用户0461939110,40148625948,2474498918,681848400
这部片已经刷爆了我的朋友圈了好吗,纯洁抽蚕满哑蹦,40148421048,2474451922,681848400
剧情全部都是超赞的，好好看,飘散绝宾凡带,40148365648,2474881672,681848400
从头到尾的剧情都紧紧牵动我的心，很棒。,悲恋臂测骄治,40148126948,2479704393,681848400
这部剧非常好看，满满的诚意之作！,哀怨写兼芽浑,40148027048,2479927677,681848400
感觉这部剧和其他的剧不一样诶，很用心，不是稀里糊涂的。,心慌摘,40147412648,2472836832,681848400
不错，我看得很带劲，超级爱,组成渡继执,40146831948,2479498554,681848400
真是一部有内涵的剧，没有故事的人是看不懂的。,进蛇铲zvihi,40146371548,2474339568,681848400
最爱的一部片子，我觉得非常棒,欢畅仰五,40145285448,2479696727,681848400
烂出天际了……,爱喝粥的西门凌晴,40145152248,1421415097,681848400
感觉这部剧和其他的剧不一样诶，很用心，不是稀里糊涂的。,赵-子龙之云看盘实盘,40109202448,2474875700,681848400
挺爱看这个电影，很好看,红润搞茅雷,40105072748,2479728145,681848400
会一直支持这部电影的,语素亏,40103479848,2472369712,681848400
真的很爱这样的剧情呀，这么地精彩哈,参差杜圆,40102612848,2479861235,681848400
好佩服编剧啊，这部剧真不错,爱吃蛋糕的端木聪慧,40102606848,2474376048,681848400
被这部剧圈粉啦，真的超级好看！,用户6083552875,40089951948,2474888949,681848400
全是水军,爱摔跤de高堂向阳,40062808848,1328699998,681848400
女的就跟傻缺一样,爱摔跤de高堂向阳,40062740648,1328699998,681848400
现在的电影都拍得像坨屎一样。,爱赛跑的东里凝雨,40053398148,1405673775,681848400
这样的剧情太棒了，好爱这么有意思的情节,花亦凡思虑云丝惯十,40024769648,2471904031,681848400
这样的剧情太棒了，好爱这么有意思的情节,拥有翅谋笔,40024606548,2472712276,681848400
感觉这部剧和其他的剧不一样诶，很用心，不是稀里糊涂的。,慎拿业愁闷租冒倘,40022257648,2474292078,681848400
真的很爱这样的剧情呀，这么地精彩哈,饶人除伶糠然,40022217948,2473141711,681848400
不咋的,177****7427_m1284,40007182348,1275506686,681848400
那个老东西是什么鬼！演的太烂了,唐乾_qq1323,39973706848,2170485041,681848400
乱七八糟的没看到一半就实在看不下去了,183****7043_m1816,39954511748,1177776287,681848400
插心脏。 心脏在右边么 穿帮了,Drug Lover_wx2681,39935161548,2467945574,681848400
开头压根都没咬。脖子很干净,Drug Lover_wx2681,39935215448,2467945574,681848400
几百年的人了换心慈手软，劳资就呵呵,边缘人一一,39933832248,2350733248,681848400
不错，我看得很带劲，超级爱,从查赌昏jyibx,40039402748,2474271469,681848400
这部剧拍得非常用心，很好看,宗政桨粗思想屡午,40039144248,2474898395,681848400
这部剧非常好看，满满的诚意之作！,长孙畜诊蒜存仰,40039136448,2472748904,681848400
没有想到剧情竟然会这样发展。,组成采析练熔番,40038906948,2479563187,681848400
很明显，这女的就是吸血女王,傲娇的萌小淑,40038902348,1366285052,681848400
这么好的片子，我当然是不会错过的。,谁假都没你假偲,40038562848,2480149536,681848400
这真是一部非常用心的影视作品。,寂静怎烘宽有问泊,40038441648,2479570397,681848400
内容精彩，剧情跌宕起伏。,忧伤隶替剧旱,40038230348,2479573118,681848400
感觉自己已经深深中了这部剧的毒了。,静谧捡庆架缺,40036795548,2479817213,681848400
剧情这样安排真的是厉害了。,思理准缝牧粘胡炼,40035762948,2474583102,681848400
这个男主角好老啊，笑起来眼睛也没有了,135****2368_m1792,39930750748,1202324524,681848400
我勃了,潜行之鲷_75712,39929562748,999999999,681848400
我看着那个演员好想我爱的那个女人！！！！,孙世傲,39927341648,2118743351,681848400
难道吸血鬼心在右边,周洁妹子,39920737348,1307093490,681848400
。。。。什么鬼？,Air橤,39920753948,1420621509,681848400
[心]看[心]pian[心]点[心]我[心]m,逆船-激情xo-视频,39912719248,999999999,681848400
看着不错这个,爱喝白酒de羊角正思,39907265448,1355517237,681848400
快快看起来,她说现在这样就很好_,39893696948,999999999,681848400
嗨嗨,连个名字就让占了,39899195248,1237272622,681848400
不错不错,大明红红火火,39896276348,1327278547,681848400
根本不够看！导演多拍一点吧,梁范凶恋恋影,40035269248,2479729771,681848400
剧情蛮丰富的，哈哈有的地方也很好玩,伤感浴湿岗奔,40035141148,2479763860,681848400
这部片已经刷爆了我的朋友圈了好吗,苗条阶,40035133548,2479813900,681848400
会一直支持这部电影的,染竖下wils,40034220048,2474306548,681848400
朋友分享给我的，一看就爱上了,舒展痕到繁,40033931048,2479788226,681848400
好佩服编剧啊，这部剧真不错,纯洁错尖,40030728748,2474272226,681848400
我要把这个剧转发出去呀，让更多人看到。,黑暗蹄云,40029838948,2479713032,681848400
从头到尾的剧情都紧紧牵动我的心，很棒。,用户0776745290,40029822448,2474372268,681848400
这个剧真的很有看头，看的停不下来。,用户6017870795,40029658348,2466478206,681848400
演员们都很敬业，演技很好。,美好宋呆纠,40029642448,2479858002,681848400
虽然害怕，但还是忍不住想看,浴兰碎位,40143794748,2480022626,681848400
垃圾,无影伏羲,40106752248,2202241163,681848400
虽然挺吓人的，但是就是想看,参傲晃npch,40106230648,2474278280,681848400
好垃圾,拉斯卡,40044027648,2231990763,681848400
好垃圾,189****0120_m1260,40042213048,1166939348,681848400
这是什么垃圾电影啊，真为中国电影堪忧,135****2010_m1215,40041768648,1238653262,681848400
虽然害怕，但还是忍不住想看,思量跪恳,40039608648,2479842669,681848400
垃圾电影,爱玩保龄球の闾丘南琴,40036782748,1415667764,681848400
身什么乱七八糟的,琳少………,40036571348,1209376471,681848400
浪费时间,SEHUNwnr12,40035140248,1360743560,681848400
没意思,好动の贾斯廷法利,40023497148,1345058850,681848400
编剧就是新手吧    太无脑,187****2200_m1455,40004721948,1210093293,681848400
垃圾,槑嬲槑嬲槑,39971290948,2207741990,681848400
真垃圾,爱打乒乓球的南野昭昭,39954505748,1392597525,681848400
最难看,(๑•ั็ω•็ั๑(●´・,39949715048,2346041341,681848400
垃圾结局,爱马拉松de北堂绍钧,39945425048,1360824871,681848400
垃圾,183****9557_m1251,39943527148,1296693395,681848400
主角演的不好看,152****4372_m1040,39942384248,1284705586,681848400
什么垃圾,守候木屋,39941297048,1417970241,681848400
什么鬼？拜托爱奇艺能不能上个好看的电影呀,刘伟_qqyvqw1,39939915448,2257426421,681848400
垃圾片,奶瓶喝可乐,39939541548,1360737815,681848400
恶心,伍明辉_wx1586,39935170748,2452693095,681848400
垃圾,边缘人一一,39934449048,2350733248,681848400
好垃圾的电影！,爱阅读の夹谷念雁,39931640848,2499413794,681848400
垃圾中战斗机,180****0500_m1776,39931233148,1098198820,681848400
垃圾电影,♚一个人～,39928444448,2468710257,681848400
麻的。演的什么鬼……难看的要死。,137****9207_m1939,39912881948,1086572117,681848400
垃圾,爱探险的夹谷情韵,39909813448,1398304226,681848400
垃圾了,叶伟玲15012142826,39901658348,1265807758,681848400
垃圾,187****2827_m1143,39901313748,1225069777,681848400
评论都是被买通的吧,天台%龙爷,40041474948,2449621924,681848400
太垃圾了没见过比这再垃圾的了,♥初相识♥,40034989548,2408263521,681848400
演的什么啊！没劲太差劲,139****3963_m2471,39909801448,1180772294,681848400
不好看。垃圾英叔的才好看,爱吃绿豆沙的女娲弘毅,39907133748,1393197838,681848400
6分05一直问那个小孩在哪  你们是不是傻？ 妈的浪费老子时间 真TM垃圾的电影,博博呀1,39935227648,1346741220,681848400
特效超过5毛，演技没法说，做作强，县乡可以出头，灵魂感没有体现，差劲,薇薇573,39920439148,2004910561,681848400
这部剧的风格还是很不错的，我很喜欢哦。,筐谈累刃vvesj,40149211848,2474283951,681848400
这个剧拍的很有亮点的，忍不住要赞一下的,语素缘有,40149015148,2479476783,681848400
这剧真是太好看了，我真是太喜欢了呀。,扁平螺,40149009348,2474624867,681848400
非常好，我喜欢，你也喜欢,MMHH18享壹哲悠慧,40148993548,1412916670,681848400
这个剧真的很有看头，看的停不下来。,词语燥昨桐墓叠雄,40141833448,2479848549,681848400
什么啊,张韩韩,40127973948,2196198119,681848400
这剧真是太好看了，我真是太喜欢了呀。,干燥忠点坚急务,40125077248,2479702743,681848400
真心不错啊，演员都挺会表演的，我很喜欢看,思考慈捞,40123986948,2474285750,681848400
根本不够看！导演多拍一点吧,畏缩容里写让排,40123815248,2480299728,681848400
我要把这个剧转发出去呀，让更多人看到。,吻泪灬Forever丷,40123348348,2468380473,681848400
这部剧感人的地方很多，我特别喜欢。,揪扫胁杜wkwc,40122640248,2474838579,681848400
我觉得演员们演的都挺好的。,恐惧屋亮顺,40122416348,2473181861,681848400
我很多朋友都在看这剧，我也十分喜欢。,多少须乎,40122331148,2473131703,681848400
没有想到剧情竟然会这样发展。,积恋妙掌览,40122016848,2474900185,681848400
剧情全部都是超赞的，好好看,轩然脉介钓,40121241248,2479704110,681848400
虽然害怕，但还是忍不住想看,声掩pu2enes艹,40120646348,2466477228,681848400
这部剧看得我很兴奋，剧情太给力了！,务想现窗dsfqr,40120206948,2474475664,681848400
这部电影给我的感觉就是恐惧和好看,气愤呈倍绣帅,40119488748,2479841319,681848400
这部电影的确是吸引到我了,钦仰烫迹栽失,40119382748,2474990667,681848400
我成了死忠粉了，剧情真的很好精彩,忧伤虚角滩垦,40119143948,2479481659,681848400
喜欢这种类型的电影。,丑陋猛殊赢袍决,40115682348,2479836742,681848400
我刚刚看了一下演员表，都是我所爱的！,颠食淘育uqkwi,40115670948,2474483895,681848400
蛮喜欢这个电影的感觉。,轩昂怪丹,40115056148,2474875771,681848400
已经分享给朋友了，太好看了,流恋紧莲,40114991148,2474415205,681848400
给好多朋友推荐了，都说很好看。,素雅主际绸,40114777348,2480078631,681848400
好棒的一部剧啊，我真的好喜欢看呢,用户6058884162,40114143948,2471869615,681848400
这么好的片子，我当然是不会错过的。,直到变成一首歌柺,40113952748,2475014603,681848400
编剧也是脑洞大开呀，想到一个这么好的故事。,热恋乔仍,40113597548,2479864654,681848400
这真是一部非常用心的影视作品。,呼吸本,40108403748,2479806556,681848400
这部戏是一部很轻松的剧，很好看的,怒放菠润乳陪,40107248148,2474267613,681848400
全程被这么棒的剧情吸引，看得很投入。,怒斥抵知虫恐摄,40100865548,2479830605,681848400
演员们都很敬业，演技很好。,素雅枣难确浇稼,40100201248,2479860242,681848400
我只想说一句，西丽你没胸就不要死命挤那么大行吗？？？？？？？,开心果_wx7432,40099575448,2366318890,681848400
演员的演技都很不错呀，我好喜欢看呀。,丑陋总阵份化,40099488148,2479703118,681848400
这种垃圾片子        拍的还假的不行      一个字        烂,张卫政_qq1121,40099398748,2325632080,681848400
朋友分享给我的，一看就爱上了,舒展痕到繁,40033931048,2479788226,681848400
最爱的一部片子，我觉得非常棒,微小很途恢谜,40031791348,2479932294,681848400
好佩服编剧啊，这部剧真不错,纯洁错尖,40030728748,2474272226,681848400
这部剧真的没有让我失望，超级喜欢。,颤抖强诊疯逃溪,40031034748,2474886232,681848400
我要把这个剧转发出去呀，让更多人看到。,黑暗蹄云,40029838948,2479713032,681848400
这个剧真的很有看头，看的停不下来。,用户6017870795,40029658348,2466478206,681848400
从头到尾的剧情都紧紧牵动我的心，很棒。,用户0776745290,40029822448,2474372268,681848400
演员们都很敬业，演技很好。,美好宋呆纠,40029642448,2479858002,681848400
这么精彩的故事情节真的是太棒了。,失恋巧贪绑壁,40027889548,2474446813,681848400
剧情全部都是超赞的，好好看,万春寒蓬松西门批竞华,40027622848,2472368133,681848400
想看的时候，挡都挡不住，太好看了,用户6084299813,40027608848,2474476075,681848400
被这部剧圈粉啦，真的超级好看！,凉笙丶情痴癶,40026704048,2466504553,681848400
如此精彩的剧，一定要支持哦。,刘雪卉甘苦岳梨膛铃,40025858148,2472376725,681848400
好好看耶，比那些老套剧情好看多了！超爱！,情恋转家,40018642748,2474615271,681848400
女主太贱了,我喜欢的猪宝宝,40016511248,2327944222,681848400
这样神一样的电影我也是醉了，我还看了十分钟,131****3921_m1469,40016388548,1205215769,681848400
这刀都没有红,139****2750_m1053,40012423448,1189191428,681848400
我的世界,183****5205_m1239,40009559248,1224226674,681848400
我们，我们的故事，,183****5205_m1239,40008489748,1224226674,681848400
主演真的好演技，好爱这精彩的表演,项彩垫证pbjzl,40024757848,2474509796,681848400
这样的剧情太棒了，好爱这么有意思的情节,花亦凡思虑云丝惯十,40024769648,2471904031,681848400
这样的剧情太棒了，好爱这么有意思的情节,拥有翅谋笔,40024606548,2472712276,681848400
傻逼到不能傻逼的电影,哥狠好你滚,40024413148,2006564053,681848400
感觉这部剧和其他的剧不一样诶，很用心，不是稀里糊涂的。,慎拿业愁闷租冒倘,40022257648,2474292078,681848400
真的很爱这样的剧情呀，这么地精彩哈,饶人除伶糠然,40022217948,2473141711,681848400
现在的电影怎么怎么狗血，一点感觉都没有，辣鸡电影，开会员都后悔，就这样的电影也配VIP会员观看,雪中送炭的瓦格纳佩尔曼,40021201848,2451117629,681848400
不咋的,177****7427_m1284,40007182348,1275506686,681848400
在女的在胸,159****6365_m1849,40006088648,1290552682,681848400
浪片,儿东先生c,40002675748,2454923491,681848400
辣鸡,辣条小时候,40000263148,2341390935,681848400
这个男一号太老了！4、5十岁,小丸子琪琪格,39999799648,1416037464,681848400
女王身材好，前挺后翘，,爱吃面条的公仲易真,39994627848,1408301444,681848400
现在的电影一点都不好看,184****7459_m1622,39987374948,1240117650,681848400
我去一会高跟鞋一会平底鞋,138****9435_m1029,39987376948,1198575831,681848400
挺爱看这个电影，很好看,浴兰灯焦禁,39979670948,2474333610,681848400
我能说那个老头儿的假牙都是歪的吗？,鹿♥鹿鹿鹿鹿鹿晗,39979366848,1282593233,681848400
